Brazil,Carangoides bartholomaei,Yellow jack,CARABA,"Fishbase (2010) Life History Data on Carangoides bartholomaei, yellow jack. Accessed 12/11/2015.","Fishbase (2010) Life History Data on Carangoides bartholomaei, yellow jack. Accessed 12/11/2015.","Fishbase (2010) Life History Data on Carangoides bartholomaei, yellow jack. Accessed 12/11/2015.","Fishbase (2010) Life History Data on Carangoides bartholomaei, yellow jack. Accessed 12/11/2015.","Ferreira BP, F. Corrêa, & AN Ferraz (1998) Relações morfométricas em peixes recifais da zona econômica exclusiva brasileira, região nordeste. Bol. Téc. Cient. CEPENE, 6(1), 61-76. Referenced on Fishbase.","Ferreira BP, F. Corrêa, & AN Ferraz (1998) Relações morfométricas em peixes recifais da zona econômica exclusiva brasileira, região nordeste. Bol. Téc. Cient. CEPENE, 6(1), 61-76. Referenced on Fishbase.","Silva Santos MN (2012) Reproducao e alimentacao da guarajuba Carangoides bartholomaei (Cuvier, 1833) (Perciformes: Carangidae) na plataforma continental de Pernambuco, Brasil. Postgraduate thesis, Universidade Federal de Pernambuco.","Silva Santos MN (2012) Reproducao e alimentacao da guarajuba Carangoides bartholomaei (Cuvier, 1833) (Perciformes: Carangidae) na plataforma continental de Pernambuco, Brasil. Postgraduate thesis, Universidade Federal de Pernambuco."
Brazil,Scomberomorus brasiliensis,Spanish mackerel,SCOMBR,"Nobrega MF & RP Lessa (2009) Age and growth of Spanish mackerel (Scomberomorus brasiliensis) off the northeastern coast of Brazil. Neotropical Ichthyology 7(4).
","Nobrega MF & RP Lessa (2009) Age and growth of Spanish mackerel (Scomberomorus brasiliensis) off the northeastern coast of Brazil. Neotropical Ichthyology 7(4).
","Nobrega MF & RP Lessa (2009) Age and growth of Spanish mackerel (Scomberomorus brasiliensis) off the northeastern coast of Brazil. Neotropical Ichthyology 7(4).
","Mattos S, F Maynou, & R Franquesa (2006) A bio-economic analysis of the hand-line and gillnet coastal fisheries of Pernambuco State, north-eastern Brazil. Scientia Marina, 70(2), 335-346.","Nóbrega MF, FL Frédou, RP Lessa, & FV Hazin (2004) Scomberomorus brasiliensis. In RP Lessa, MF Nóbrega & JL Bezerra Jr. (eds.) Dinâmica de populações e avaliação de estoques dos recursos pesqueiros da região nordeste. Volume II. DIMAR. Recife-Brazil, Departamento de Pesca - Universidade Federal Rural de Pernambuco. pp. 51-68.
","Nóbrega MF, FL Frédou, RP Lessa, & FV Hazin (2004) Scomberomorus brasiliensis. In RP Lessa, MF Nóbrega & JL Bezerra Jr. (eds.) Dinâmica de populações e avaliação de estoques dos recursos pesqueiros da região nordeste. Volume II. DIMAR. Recife-Brazil, Departamento de Pesca - Universidade Federal Rural de Pernambuco. pp. 51-68.
","Nóbrega MF & RP Lessa (2009) Espécies Pelágicas, Scomberomorus brasiliensis. In: RP Lessa, MF Nobrega, JL Bezerra Jr., et al. (Eds.). Dinâmica de populações e avaliação dos estoques dos recursos pesqueiros da região nordeste. Fortaleza, Martins & Cordeiro Ltda. pp. 64-75.",Incofish equation.
Brazil,Ocyurus chrysurus,Yellowtail snapper,OCYUCH,"de Araujo JN, A Silva Martins, & K Goncalves da Costa (2002) Idades e crescimento da cioba, Ocyurus chrysurus, da Costa Central do Brasil. Revista Brasileira de Oceanografia, 50, 47-57.

","de Araujo JN, A Silva Martins, & K Goncalves da Costa (2002) Idades e crescimento da cioba, Ocyurus chrysurus, da Costa Central do Brasil. Revista Brasileira de Oceanografia, 50, 47-57.

","de Araujo JN, A Silva Martins, & K Goncalves da Costa (2002) Idades e crescimento da cioba, Ocyurus chrysurus, da Costa Central do Brasil. Revista Brasileira de Oceanografia, 50, 47-57.

","Gomes de Mattos SM & F Maynou (2009) Virtual population analysis of two snapper species, Lutjanus analis and Lutjanus chrysurus, caught off Pernambuco State, north-eastern Brazil. Brazilian Journal of Oceanography, 57(3).","Frota LO, PAS Costa, & AC Braga (2004) Length-weight relationships of marine fishes from the central Brazilian coast. NAGA WorldFish Center Quarterly, 27(1&2), 20-26.","Frota LO, PAS Costa, & AC Braga (2004) Length-weight relationships of marine fishes from the central Brazilian coast. NAGA WorldFish Center Quarterly, 27(1&2), 20-26.","Franco MAL., PAS Costa, AC Braga, & J Nardino (2005) Aspectos reprodutivos da guaiúba, Ocyurus chrysurus (Bloch, 1791), desembarcada pela frota de linheiros de Porto Seguro-BA, entre 1997-2000. In: PAS Costa, AS Martins, & G Olavo (Eds.). Pesca e potenciais de exploração de recursos vivos na região central da Zona Econômica Exclusiva brasileira. Rio de Janeiro: Museu Nacional (Série Livros, 13), p. 231-240.","Franco MAL., PAS Costa, AC Braga, & J Nardino (2005) Aspectos reprodutivos da guaiúba, Ocyurus chrysurus (Bloch, 1791), desembarcada pela frota de linheiros de Porto Seguro-BA, entre 1997-2000. In: PAS Costa, AS Martins, & G Olavo (Eds.). Pesca e potenciais de exploração de recursos vivos na região central da Zona Econômica Exclusiva brasileira. Rio de Janeiro: Museu Nacional (Série Livros, 13), p. 231-240."
Brazil,Callinectes sapidus,Atlantic blue crab,CALLSA,"Ferreira LS & F D'Incao (2008) Crescimento de Callinectes sapidus (Crustacea, Decapoda, Portunidae) no estuario da laguna dos Patos, RS, Brasil. Iheringia, Serie Zoologia, 98(1), 70-77.","Ferreira LS & F D'Incao (2008) Crescimento de Callinectes sapidus (Crustacea, Decapoda, Portunidae) no estuario da laguna dos Patos, RS, Brasil. Iheringia, Serie Zoologia, 98(1), 70-77.","Ferreira LS & F D'Incao (2008) Crescimento de Callinectes sapidus (Crustacea, Decapoda, Portunidae) no estuario da laguna dos Patos, RS, Brasil. Iheringia, Serie Zoologia, 98(1), 70-77.","Hewitt DA, DM Lambert, JM Hoenig et al (2007) Direct and indirect estimates of natural mortality for Chesapeake Bay blue crab. Transactions of the American Fisheries Society, 136(4), 1030-1040.","Pereira MJ, JO Branco, ML Christoffersen et al. (2009) Population biology of Callinectes danae and Callinectes sapidus (Crustacea: Brachyura: Portunidae) in the south-western Atlantic. Journal of the Marine Biological Association of the United Kingdom, 1-11.","Pereira MJ, JO Branco, ML Christoffersen et al. (2009) Population biology of Callinectes danae and Callinectes sapidus (Crustacea: Brachyura: Portunidae) in the south-western Atlantic. Journal of the Marine Biological Association of the United Kingdom, 1-11.","Severino-Rodrigues E, J Musiello-Fernandes, AA Moura et al. (2013) Fecundity, reproductive seasonality and maturation size of Callinectes sapidus females (Decapoda: Portunidae) in the Southeast coast of Brazil. Revista de Biologia Tropical, 61(2), 595-602.","Severino-Rodrigues E, J Musiello-Fernandes, AA Moura et al. (2013) Fecundity, reproductive seasonality and maturation size of Callinectes sapidus females (Decapoda: Portunidae) in the Southeast coast of Brazil. Revista de Biologia Tropical, 61(2), 595-602."
Brazil,Mytella guyanensis,Mangrove mussel,MYTEGU,NA,NA,NA,NA,NA,NA,"Cruz RA & CR Villalobos (1993) Shell length at sexual maturity and spawning cycle of Mytella guyanensis (Bivalvia: Mytilidae) from Bosta Rica. Revista de Biologia Tropical, 41(1), 89-92.","Cruz RA & CR Villalobos (1993) Shell length at sexual maturity and spawning cycle of Mytella guyanensis (Bivalvia: Mytilidae) from Bosta Rica. Revista de Biologia Tropical, 41(1), 89-92."
Brazil,Ucides cordatus,Mangrove crab,UCIDCO,"Diele K & V Koch (2010) Growth and mortality of the exploited mangrove crab Ucides cordatus (Ucididae) in N Brazil. Journal of Experimental Marine Biology & Ecology 395(1-2), 171-180.","Diele K & V Koch (2010) Growth and mortality of the exploited mangrove crab Ucides cordatus (Ucididae) in N Brazil. Journal of Experimental Marine Biology & Ecology 395(1-2), 171-180.","Diele K & V Koch (2010) Growth and mortality of the exploited mangrove crab Ucides cordatus (Ucididae) in N Brazil. Journal of Experimental Marine Biology & Ecology 395(1-2), 171-180.","Diele K & V Koch (2010) Growth and mortality of the exploited mangrove crab Ucides cordatus (Ucididae) in N Brazil. Journal of Experimental Marine Biology & Ecology 395(1-2), 171-180.","Bastos Moraes EE, BJ Bezerra Nunesmaia, & MA Amaro Pinheiro (2015) Population biology of the 'uca'-crab, Ucides cordatus (Linnaeus, 1763) (Brachyura: Ucididae), in mangroves of the Joanes River, Bahia State, Brazil. Naupilus 23(1), 59-71.","Bastos Moraes EE, BJ Bezerra Nunesmaia, & MA Amaro Pinheiro (2015) Population biology of the 'uca'-crab, Ucides cordatus (Linnaeus, 1763) (Brachyura: Ucididae), in mangroves of the Joanes River, Bahia State, Brazil. Naupilus 23(1), 59-71.","Bastos Moraes EE, BJ Bezerra Nunesmaia, & MA Amaro Pinheiro (2015) Population biology of the 'uca'-crab, Ucides cordatus (Linnaeus, 1763) (Brachyura: Ucididae), in mangroves of the Joanes River, Bahia State, Brazil. Naupilus 23(1), 59-71.",Incofish equation.
Brazil,Coryphaena hippurus,Dolphinfish,CORYHI,"Lessa, RP, MF Nóbrega, & JL Bezerra Jr (2004) Dinâmica de populações e avaliação de estoques dos recursos pesqueiros da região nordeste. Volume II. Recife-Brazil, DIMAR, Departamento de Pesca - Universidade Federal Rural de Pernambuco. pp. 245.","Lessa, RP, MF Nóbrega, & JL Bezerra Jr (2004) Dinâmica de populações e avaliação de estoques dos recursos pesqueiros da região nordeste. Volume II. Recife-Brazil, DIMAR, Departamento de Pesca - Universidade Federal Rural de Pernambuco. pp. 245.","Lessa, RP, MF Nóbrega, & JL Bezerra Jr (2004) Dinâmica de populações e avaliação de estoques dos recursos pesqueiros da região nordeste. Volume II. Recife-Brazil, DIMAR, Departamento de Pesca - Universidade Federal Rural de Pernambuco. pp. 245.","Lessa, RP, MF Nóbrega, & JL Bezerra Jr (2004) Dinâmica de populações e avaliação de estoques dos recursos pesqueiros da região nordeste. Volume II. Recife-Brazil, DIMAR, Departamento de Pesca - Universidade Federal Rural de Pernambuco. pp. 245.","Frota LO, PAS Costa, & AC Braga (2004) Length-weight relationships of marine fishes from the central Brazilian coast. NAGA WorldFish Center Quarterly, 27(1&2), 20-26.","Frota LO, PAS Costa, & AC Braga (2004) Length-weight relationships of marine fishes from the central Brazilian coast. NAGA WorldFish Center Quarterly, 27(1&2), 20-26.","Schwenke KL & KA Buckel (2008) Age, growth, and reproduction of dolphinfish (Coryphaena hippurus) caught off the coast of North Carolina. Fisheries Bulletin, 106, 82-92.","Schwenke KL & KA Buckel (2008) Age, growth, and reproduction of dolphinfish (Coryphaena hippurus) caught off the coast of North Carolina. Fisheries Bulletin 106, 82-92."
Brazil,Euthynnus alletteratus,Little tunny,EUTHAL,"Valeiras X, D Macias, MJ Gomez, L Lema, et al. (2008) Age and growth of the Atlantic little tuna (Euthynnus alletteratus) in the Western Mediterranean Sea. ICCAT 62(5), 1638-1648. http://www.iccat.int/documents/cvsp/cv062_2008/no_5/CV062051638.pdf","Valeiras X, D Macias, MJ Gomez, L Lema, et al. (2008) Age and growth of the Atlantic little tuna (Euthynnus alletteratus) in the Western Mediterranean Sea. ICCAT 62(5), 1638-1648. http://www.iccat.int/documents/cvsp/cv062_2008/no_5/CV062051638.pdf","Valeiras X, D Macias, MJ Gomez, L Lema, et al. (2008) Age and growth of the Atlantic little tuna (Euthynnus alletteratus) in the Western Mediterranean Sea. ICCAT 62(5), 1638-1648.","Valeiras X, D Macias, MJ Gomez, L Lema, et al. (2008) Age and growth of the Atlantic little tuna (Euthynnus alletteratus) in the Western Mediterranean Sea. ICCAT 62(5), 1638-1648.","Frota LO, PAS Costa, & AC Braga (2004) Length-weight relationships of marine fishes from the central Brazilian coast. NAGA WorldFish Center Quarterly, 27(1&2), 20-26.","Frota LO, PAS Costa, & AC Braga (2004) Length-weight relationships of marine fishes from the central Brazilian coast. NAGA WorldFish Center Quarterly, 27(1&2), 20-26.","Valeiras X, D Macias, MJ Gomez, L Lema, et al. (2008) Age and growth of the Atlantic little tuna (Euthynnus alletteratus) in the Western Mediterranean Sea. ICCAT 62(5), 1638-1648.",Incofish equation.
Brazil,Hemiramphus brasiliensis,Ballyhoo,HEMIBR,"Fernandez Gonzolo G (2008) Idade e crescimento de Hemiramphus brasiliensis (Linnaeus, 1758) no litoral de Pernambuco. Master's thesis, Universidade Federal de Pernambuco.","Fernandez Gonzolo G (2008) Idade e crescimento de Hemiramphus brasiliensis (Linnaeus, 1758) no litoral de Pernambuco. Master's thesis, Universidade Federal de Pernambuco.","Fernandez Gonzolo G (2008) Idade e crescimento de Hemiramphus brasiliensis (Linnaeus, 1758) no litoral de Pernambuco. Master's thesis, Universidade Federal de Pernambuco.","Fernandez Gonzolo G (2008) Idade e crescimento de Hemiramphus brasiliensis (Linnaeus, 1758) no litoral de Pernambuco. Master's thesis, Universidade Federal de Pernambuco.","Lessa, RP, MF Nóbrega, & JL Bezerra Jr (2004) Dinâmica de populações e avaliação de estoques dos recursos pesqueiros da região nordeste. Volume II. Recife-Brazil, DIMAR, Departamento de Pesca - Universidade Federal Rural de Pernambuco. pp. 245.","Lessa, RP, MF Nóbrega, & JL Bezerra Jr (2004) Dinâmica de populações e avaliação de estoques dos recursos pesqueiros da região nordeste. Volume II. Recife-Brazil, DIMAR, Departamento de Pesca - Universidade Federal Rural de Pernambuco. pp. 245.","Lessa, RP, MF Nóbrega, & JL Bezerra Jr (2004) Dinâmica de populações e avaliação de estoques dos recursos pesqueiros da região nordeste. Volume II. Recife-Brazil, DIMAR, Departamento de Pesca - Universidade Federal Rural de Pernambuco. pp. 245.",Incofish equation.
Brazil,Hyporhamphus unifasciatus,Common halfbeak,HYPOUN,"Monteiro A, AC Ribeiro, MF Nóbrega, & RP Lessa (2004) Hyporhamphus unifasciatus. In RP Lessa, MF Nóbrega, & JLB Junior. Dinâmica de populações e avaliação de estoques dos recursos pesqueiros da região nordeste. Volume II. DIMAR. Recife-Brazil, Departamento de Pesca - Universidade Federal Rural de Pernambuco: p. 151-169.","Monteiro A, AC Ribeiro, MF Nóbrega, & RP Lessa (2004) Hyporhamphus unifasciatus. In RP Lessa, MF Nóbrega, & JLB Junior. Dinâmica de populações e avaliação de estoques dos recursos pesqueiros da região nordeste. Volume II. DIMAR. Recife-Brazil, Departamento de Pesca - Universidade Federal Rural de Pernambuco: p. 151-169.","Monteiro A, AC Ribeiro, MF Nóbrega, & RP Lessa (2004) Hyporhamphus unifasciatus. In RP Lessa, MF Nóbrega, & JLB Junior. Dinâmica de populações e avaliação de estoques dos recursos pesqueiros da região nordeste. Volume II. DIMAR. Recife-Brazil, Departamento de Pesca - Universidade Federal Rural de Pernambuco: p. 151-169.","Monteiro A, AC Ribeiro, MF Nóbrega, & RP Lessa (2004) Hyporhamphus unifasciatus. In RP Lessa, MF Nóbrega, & JLB Junior. Dinâmica de populações e avaliação de estoques dos recursos pesqueiros da região nordeste. Volume II. DIMAR. Recife-Brazil, Departamento de Pesca - Universidade Federal Rural de Pernambuco: p. 151-169.","Monteiro A, AC Ribeiro, MF Nóbrega, & RP Lessa (2004) Hyporhamphus unifasciatus. In RP Lessa, MF Nóbrega, & JLB Junior. Dinâmica de populações e avaliação de estoques dos recursos pesqueiros da região nordeste. Volume II. DIMAR. Recife-Brazil, Departamento de Pesca - Universidade Federal Rural de Pernambuco: p. 151-169.","Monteiro A, AC Ribeiro, MF Nóbrega, & RP Lessa (2004) Hyporhamphus unifasciatus. In RP Lessa, MF Nóbrega, & JLB Junior. Dinâmica de populações e avaliação de estoques dos recursos pesqueiros da região nordeste. Volume II. DIMAR. Recife-Brazil, Departamento de Pesca - Universidade Federal Rural de Pernambuco: p. 151-169.","Monteiro A, AC Ribeiro, MF Nóbrega, & RP Lessa (2004) Hyporhamphus unifasciatus. In RP Lessa, MF Nóbrega, & JLB Junior. Dinâmica de populações e avaliação de estoques dos recursos pesqueiros da região nordeste. Volume II. DIMAR. Recife-Brazil, Departamento de Pesca - Universidade Federal Rural de Pernambuco: p. 151-169.",Incofish equation.
Brazil,Lobotes surinamensis,Tripletail,LOBOSU,"Merriner JV & WA Foster (1974) Life history aspects of the tripletail, Lobotes surinamensis (Chordata-Pisces-Lobotidae), in North Carolina waters. Journal of the Elisha Mitchell Science Society, 90(4), 121-124.","Merriner JV & WA Foster (1974) Life history aspects of the tripletail, Lobotes surinamensis (Chordata-Pisces-Lobotidae), in North Carolina waters. Journal of the Elisha Mitchell Science Society, 90(4), 121-124.","Merriner JV & WA Foster (1974) Life history aspects of the tripletail, Lobotes surinamensis (Chordata-Pisces-Lobotidae), in North Carolina waters. Journal of the Elisha Mitchell Science Society, 90(4), 121-124.","Merriner JV & WA Foster (1974) Life history aspects of the tripletail, Lobotes surinamensis (Chordata-Pisces-Lobotidae), in North Carolina waters. Journal of the Elisha Mitchell Science Society, 90(4), 121-124.","Minos G & PS Economidis (2015) More records on the tripletail, Lobotes surinamensis (Bloch, 1790) from the Aegean Sea. Frontiers in Marine Sciences Conference Abstract: XV European Congress of Ichthyology. doi: 10.3389/conf.fmars.2015.03.00056.","Minos G & PS Economidis (2015) More records on the tripletail, Lobotes surinamensis (Bloch, 1790) from the Aegean Sea. Frontiers in Marine Sciences Conference Abstract: XV European Congress of Ichthyology. doi: 10.3389/conf.fmars.2015.03.00056.","Parr RT (2011) Age, growth, and reproductive status of tripletail (Lobotes surinamensis) in the aggregation nearshore Jekyll Island, GA, USA. Master's thesis, University of Georgia.",Incofish equation.
Brazil,Lutjanus analis,Mutton snapper,LUTJAN,"Rezende SM, BP Ferreira, & T Fredou (2003) A pesca de lutjanideos no nordeste do Brasil: historico das pescarias, caracteristicas das especies e relevancia para o manejo. Boletin Tecnico Cient. CEPENE, 11, 257-270. (cited in Frédou T, BP Ferreira, & Y Letourneur (2009) Assessing the stocks of the primary snappers caught in Northeastern Brazil reef systems. 1: Traditional modelling approaches. Fisheries Research 99(2), 90-96.)","Rezende SM, BP Ferreira, & T Fredou (2003) A pesca de lutjanideos no nordeste do Brasil: historico das pescarias, caracteristicas das especies e relevancia para o manejo. Boletin Tecnico Cient. CEPENE, 11, 257-270. (cited in Frédou T, BP Ferreira, & Y Letourneur (2009) Assessing the stocks of the primary snappers caught in Northeastern Brazil reef systems. 1: Traditional modelling approaches. Fisheries Research 99(2), 90-96.)","Rezende SM, BP Ferreira, & T Fredou (2003) A pesca de lutjanideos no nordeste do Brasil: historico das pescarias, caracteristicas das especies e relevancia para o manejo. Boletin Tecnico Cient. CEPENE, 11, 257-270. (cited in Frédou T, BP Ferreira, & Y Letourneur (2009) Assessing the stocks of the primary snappers caught in Northeastern Brazil reef systems. 1: Traditional modelling approaches. Fisheries Research 99(2), 90-96.)","Ferreira BP, SM Rezende, SF Teixera, T Fredou, & Y Ferreira Duarte (2004) Lutjanus analis. In RP Lessa, MF Nóbrega, & JL Bezerra Jr. (eds.) Dinâmica de populações e avaliação de estoques dos recursos pesqueiros da região nordeste. Volume II. Recife-Brazil, DIMAR, Departamento de Pesca - Universidade Federal Rural de Pernambuco. pp. 78-87.","Ferreira BP, SM Rezende, SF Teixera, T Fredou, & Y Ferreira Duarte (2004) Lutjanus analis. In RP Lessa, MF Nóbrega, & JL Bezerra Jr. (eds.) Dinâmica de populações e avaliação de estoques dos recursos pesqueiros da região nordeste. Volume II. Recife-Brazil, DIMAR, Departamento de Pesca - Universidade Federal Rural de Pernambuco. pp. 78-87.","Ferreira BP, SM Rezende, SF Teixera, T Fredou, & Y Ferreira Duarte (2004) Lutjanus analis. In RP Lessa, MF Nóbrega, & JL Bezerra Jr. (eds.) Dinâmica de populações e avaliação de estoques dos recursos pesqueiros da região nordeste. Volume II. Recife-Brazil, DIMAR, Departamento de Pesca - Universidade Federal Rural de Pernambuco. pp. 78-87.",NA,"Ferreira BP, SM Rezende, SF Teixera, T Fredou, & Y Ferreira Duarte (2004) Lutjanus analis. In RP Lessa, MF Nóbrega, & JL Bezerra Jr. (eds.) Dinâmica de populações e avaliação de estoques dos recursos pesqueiros da região nordeste. Volume II. Recife-Brazil, DIMAR, Departamento de Pesca - Universidade Federal Rural de Pernambuco. pp. 78-87."
Brazil,Megalops atlanticus,Atlantic tarpon,MEGAAT,"Ferreira de Menezes M & M Pinto Pavo (1966) Notes on the biology of tarpon, Tarpon atlanticus (Cuvier and Valenciennes), from coastal waters of Ceará state, Brazil. Arq. Est. Biol. Mar. Universidade Federal Ceara, 6(1), 83-98.","Ferreira de Menezes M & M Pinto Pavo (1966) Notes on the biology of tarpon, Tarpon atlanticus (Cuvier and Valenciennes), from coastal waters of Ceará state, Brazil. Arq. Est. Biol. Mar. Universidade Federal Ceara, 6(1), 83-98.","Ferreira de Menezes M & M Pinto Pavo (1966) Notes on the biology of tarpon, Tarpon atlanticus (Cuvier and Valenciennes), from coastal waters of Ceará state, Brazil. Arq. Est. Biol. Mar. Universidade Federal Ceara, 6(1), 83-98.","Ferreira de Menezes M & M Pinto Pavo (1966) Notes on the biology of tarpon, Tarpon atlanticus (Cuvier and Valenciennes), from coastal waters of Ceará state, Brazil. Arq. Est. Biol. Mar. Universidade Federal Ceara, 6(1), 83-98.","Ferreira de Menezes M (1967) Relacao comprimento-peso do camurupim, Tarpon atlanticus (Valenciennes), no nordeste brasileiro. Arquivos de Ciências do Mar, 7(1), 101-102.","Ferreira de Menezes M (1967) Relacao comprimento-peso do camurupim, Tarpon atlanticus (Valenciennes), no nordeste brasileiro. Arquivos de Ciências do Mar, 7(1), 101-102.","Ferreira de Menezes M & M Pinto Pavo (1966) Notes on the biology of tarpon, Tarpon atlanticus (Cuvier and Valenciennes), from coastal waters of Ceará state, Brazil. Arq. Est. Biol. Mar. Universidade Federal Ceara, 6(1), 83-98.",Incofish equation.
Brazil,Panulirus laevicauda,Smoothtail spiny lobster,PANULA,"Ivo CTC & JA Pereira (1996) Crescimento e idade das lagostas Panulirus argus (LATREILLE) e panulirus laevicauda (LATRILLE) no Norte e Nordeste do Brasil. Arquivos de Ciências do Mar, Fortaleza, v.30, n.1/2, p.33-39, 1996.","Ivo CTC & JA Pereira (1996) Crescimento e idade das lagostas Panulirus argus (LATREILLE) e panulirus laevicauda (LATRILLE) no Norte e Nordeste do Brasil. Arquivos de Ciências do Mar, Fortaleza, v.30, n.1/2, p.33-39, 1996.","Ivo CTC & JA Pereira (1996) Crescimento e idade das lagostas Panulirus argus (LATREILLE) e panulirus laevicauda (LATRILLE) no Norte e Nordeste do Brasil. Arquivos de Ciências do Mar, Fortaleza, v.30, n.1/2, p.33-39, 1996.","Fonteles Filho, AA (1998) Sintese sobre distribuicao, abundancia, potencial pesqueiro e biologia lagosta-vermelha Panulirus argus (Latreille) e a lagosta-verde Panulirus laevicauda (Latreille) do nordeste do Brasil. Avaliacao do Potencial Sustenavel de Recursos Vivos na Zona Economica Exclusiva MMA-REVIZEE.","Fonteles Filho, AA (1998) Sintese sobre distribuicao, abundancia, potencial pesqueiro e biologia lagosta-vermelha Panulirus argus (Latreille) e a lagosta-verde Panulirus laevicauda (Latreille) do nordeste do Brasil. Avaliacao do Potencial Sustenavel de Recursos Vivos na Zona Economica Exclusiva MMA-REVIZEE.","Fonteles Filho, AA (1998) Sintese sobre distribuicao, abundancia, potencial pesqueiro e biologia lagosta-vermelha Panulirus argus (Latreille) e a lagosta-verde Panulirus laevicauda (Latreille) do nordeste do Brasil. Avaliacao do Potencial Sustenavel de Recursos Vivos na Zona Economica Exclusiva MMA-REVIZEE.","Fonteles Filho, AA (1998) Sintese sobre distribuicao, abundancia, potencial pesqueiro e biologia lagosta-vermelha Panulirus argus (Latreille) e a lagosta-verde Panulirus laevicauda (Latreille) do nordeste do Brasil. Avaliacao do Potencial Sustenavel de Recursos Vivos na Zona Economica Exclusiva MMA-REVIZEE.",Incofish equation.
Brazil,Centropomus parallelus,Fat snook,CENTPA,"Ximenes-Carvalho MO (2006) Idade e crescimento do robalo-flecha, Centropomus undecimalis (Bloch, 1792) e robalo-peva, Centropomus parallelus (Poey, 1860) (Osteichthyes: Centropomidae), no sudeste do Brasil. Master's thesis, Universidade Federal do Ceara.","Ximenes-Carvalho MO (2006) Idade e crescimento do robalo-flecha, Centropomus undecimalis (Bloch, 1792) e robalo-peva, Centropomus parallelus (Poey, 1860) (Osteichthyes: Centropomidae), no sudeste do Brasil. Master's thesis, Universidade Federal do Ceara.","Ximenes-Carvalho MO (2006) Idade e crescimento do robalo-flecha, Centropomus undecimalis (Bloch, 1792) e robalo-peva, Centropomus parallelus (Poey, 1860) (Osteichthyes: Centropomidae), no sudeste do Brasil. Master's thesis, Universidade Federal do Ceara.","Ximenes-Carvalho MO (2006) Idade e crescimento do robalo-flecha, Centropomus undecimalis (Bloch, 1792) e robalo-peva, Centropomus parallelus (Poey, 1860) (Osteichthyes: Centropomidae), no sudeste do Brasil. Master's thesis, Universidade Federal do Ceara.","Ximenes-Carvalho MO (2006) Idade e crescimento do robalo-flecha, Centropomus undecimalis (Bloch, 1792) e robalo-peva, Centropomus parallelus (Poey, 1860) (Osteichthyes: Centropomidae), no sudeste do Brasil. Master's thesis, Universidade Federal do Ceara.","Ximenes-Carvalho MO (2006) Idade e crescimento do robalo-flecha, Centropomus undecimalis (Bloch, 1792) e robalo-peva, Centropomus parallelus (Poey, 1860) (Osteichthyes: Centropomidae), no sudeste do Brasil. Master's thesis, Universidade Federal do Ceara.","Alvarez-Lajonchere L & MY Tsuzuki (2008) A review of methods for Centropomus spp. (snooks) aquaculture and recommendations for the establishment of their culture in Latin America. Aquaculture Research, 39(7), 684-700.",Incofish equation.
