Indonesia,Panulirus ornatus,Ornate spiny lobster,PANUOR,"Phillips BF, MJ Palmer, R Cruz, & JT Trendall (1992) Estimating growth of the spiny lobsterss Panulirus cygnus, P. argus and P. ornatus. Australian Journal of Marine and Freshwater Resources, 43, 1177-1188.","Phillips BF, MJ Palmer, R Cruz, & JT Trendall (1992) Estimating growth of the spiny lobsterss Panulirus cygnus, P. argus and P. ornatus. Australian Journal of Marine and Freshwater Resources, 43, 1177-1188.","Phillips BF, MJ Palmer, R Cruz, & JT Trendall (1992) Estimating growth of the spiny lobsterss Panulirus cygnus, P. argus and P. ornatus. Australian Journal of Marine and Freshwater Resources, 43, 1177-1188.","Pitcher CR, TD Skewes, & DM Dennis (2004) Research for management of the ornate tropical rock lobster, Panulirus ornatus, fishery in Torres Strait. Final Report on CSIRO Research, 1990-1993. CSIRO Division of Fisheries, Australia.","Biusing R & CF Lin (2004) Status of spiny lobster resources in Sabah, Malaysia. In: KC Williams (ed.) Spiny lobster ecology and exploitation in the South China Sea region. Proceedings of a workshop held at the Institute or Oceanography, Nha Trang, Vietnam, July 2004. CSIRO, Canberra, Australia. pp. 7-12.","Biusing R & CF Lin (2004) Status of spiny lobster resources in Sabah, Malaysia. In: KC Williams (ed.) Spiny lobster ecology and exploitation in the South China Sea region. Proceedings of a workshop held at the Institute or Oceanography, Nha Trang, Vietnam, July 2004. CSIRO, Canberra, Australia. pp. 7-12.","Tewfik A, D Mills, & D Adhuri (2009) Spiny lobster resources and opportunity for culture in post-tsunami Aceh, Indonesia. pp. 27-34. In: Williams KC (ed.) Spiny lobster aquaculture in Asia-Pacific region. Proceedings of an international symposium held at Nha Trang, Vietnam, 9-10 December 2008. Australian Centre for International Agricultural Research, Canberra, Australia.",Incofish equation: M95=M50*1.14.
Indonesia,Panulirus versicolor,Blue or Painted spiny lobster,PANUVE,"Frisch AJ (2007) Growth and reproduction of the painted spiny lobster (Panulirus versicolor) on the Great Barrier Reef (Australia). Fisheries Research, 85(1-2), 61-67.","Frisch AJ (2007) Growth and reproduction of the painted spiny lobster (Panulirus versicolor) on the Great Barrier Reef (Australia). Fisheries Research, 85(1-2), 61-67.","Frisch AJ (2007) Growth and reproduction of the painted spiny lobster (Panulirus versicolor) on the Great Barrier Reef (Australia). Fisheries Research, 85(1-2), 61-67.","Frisch AJ & JPA Hobbs (2012) Demography, fishery yield and potential management strategies of painted spiny lobster (Panulirus versicolor) at Northwest Island, Great Barrier Reef, Austrlia. Marine and Freshwater Research, 63, 387-396.","Frisch AJ & JPA Hobbs (2012) Demography, fishery yield and potential management strategies of painted spiny lobster (Panulirus versicolor) at Northwest Island, Great Barrier Reef, Austrlia. Marine and Freshwater Research, 63, 387-396.","Frisch AJ & JPA Hobbs (2012) Demography, fishery yield and potential management strategies of painted spiny lobster (Panulirus versicolor) at Northwest Island, Great Barrier Reef, Austrlia. Marine and Freshwater Research, 63, 387-396.","MacDonald CD (1982) Catch composition and reproduction of the spiny lobster Panulirus versicolor at Palau. Transactions of the American Fisheries Society, 111, 694-699.",Incofish equation: M95=M50*1.14.
Indonesia,Plectropomus areolatus,Squaretail coral grouper,PLECAR,"Williams AJ, LM Currey, GA Begg, et al. Population biology of coral trout species in eastern Torres Strait: Implications for fishery management. Continental Shelf Research, 28(16), 2129-2142.
","Williams AJ, LM Currey, GA Begg, et al. Population biology of coral trout species in eastern Torres Strait: Implications for fishery management. Continental Shelf Research, 28(16), 2129-2142.
","Williams AJ, LM Currey, GA Begg, et al. Population biology of coral trout species in eastern Torres Strait: Implications for fishery management. Continental Shelf Research, 28(16), 2129-2142.
","Rhodes KL, BM Taylor, CB Wichilmel, E Joseph, RJ Hamilton, & GR Almany (2013) Reproductive biology of squaretail coral grouper Plectropomus areolatus using age-based techniques. Journal of Fish Biology, 82, 1333-1350.","Williams AJ, LM Currey, GA Begg, et al. Population biology of coral trout species in eastern Torres Strait: Implications for fishery management. Continental Shelf Research, 28(16), 2129-2142.
","Williams AJ, LM Currey, GA Begg, et al. Population biology of coral trout species in eastern Torres Strait: Implications for fishery management. Continental Shelf Research, 28(16), 2129-2142.
","Rhodes KL, BM Taylor, CB Wichilmel, et al. Reproductive biology of squaretail coralgrouper Plectropomus areolatus using age‐based techniques. Journal of Fish Biology, 82(4), 1333-1350.",Incofish equation: M95=M50*1.14.
Indonesia,Plectropomus leopardus,Leopard coralgrouper,PLECLE,"Ferreira BP & GR Russ (1994) Age validation and estimation of growth rate of the coral trout, Plectropomus leopardus, (Lacepede 1802) from Lizard Island, Northern Great Barrier Reef. Fishery Bulletin, 92, 46-57.","Ferreira BP & GR Russ (1994) Age validation and estimation of growth rate of the coral trout, Plectropomus leopardus, (Lacepede 1802) from Lizard Island, Northern Great Barrier Reef. Fishery Bulletin, 92, 46-57.","Ferreira BP & GR Russ (1994) Age validation and estimation of growth rate of the coral trout, Plectropomus leopardus, (Lacepede 1802) from Lizard Island, Northern Great Barrier Reef. Fishery Bulletin, 92, 46-57.","Ferreira BP & GR Russ (1994) Age validation and estimation of growth rate of the coral trout, Plectropomus leopardus, (Lacepede 1802) from Lizard Island, Northern Great Barrier Reef. Fishery Bulletin, 92, 46-57.","Kulbicki M, N Guillemot, & M Amand (2005) A general approach to length-weight relationships for New Caledonian lagoon fishes. Cybium, 29(3), 235-252.","Kulbicki M, N Guillemot, & M Amand (2005) A general approach to length-weight relationships for New Caledonian lagoon fishes. Cybium, 29(3), 235-252.","Ferreira BP (1995) Reproduction of the common coral trout Plectropomus leopardus (Serranidae: Epinephelinae) from the central and northern Great Barrier Reef, Australia. Bulletin of Marine Science, 56(2), 653-669.",Incofish equation: M95=M50*1.14.
Indonesia,Plectropomus maculatus,Spotted coral grouper,PLECMA,"Ferreira BP & GR Russ (1992) Age, growth and mortality of the inshore coral trout Plectropomus maculatus (Pisces: Serranidae) from the central Great Barrier Reef, Australia. Australian Journal of Marine and Freshwater Research, 43(5), 1301-1312.","Ferreira BP & GR Russ (1992) Age, growth and mortality of the inshore coral trout Plectropomus maculatus (Pisces: Serranidae) from the central Great Barrier Reef, Australia. Australian Journal of Marine and Freshwater Research, 43(5), 1301-1312.","Ferreira BP & GR Russ (1992) Age, growth and mortality of the inshore coral trout Plectropomus maculatus (Pisces: Serranidae) from the central Great Barrier Reef, Australia. Australian Journal of Marine and Freshwater Research, 43(5), 1301-1312.","Ferreira BP & GR Russ (1992) Age, growth and mortality of the inshore coral trout Plectropomus maculatus (Pisces: Serranidae) from the central Great Barrier Reef, Australia. Australian Journal of Marine and Freshwater Research, 43(5), 1301-1312.","Moran M, J Jenke, C Burton, & D Clarke (1988) The Western Australian trap and line fishery on the Northwest Shelf. Western Australian Marine Research Laboratories. FIRTA Project 86/28, Final Report, pp. 79.","Moran M, J Jenke, C Burton, & D Clarke (1988) The Western Australian trap and line fishery on the Northwest Shelf. Western Australian Marine Research Laboratories. FIRTA Project 86/28, Final Report, pp. 79.","Adams S (2002) The reproductive biology of three species of Plectropomus (Serranidae) and responses to fishing. PhD Thesis, James Cook University.",Incofish equation: M95=M50*1.14.
Indonesia,Plectropomus oligacanthus,Highfin coralgrouper,PLECOL,"FishBase (2010) Life history data on Plectropomus oligacanthus, highfin coralgrouper. Accessed 1/4/16. Heemstra PC & JE Randall (1993) FAO Species Catalogue. Vol. 16. Groupers of the world (family Serranidae, subfamily Epinephelinae). An annotated and illustrated catalogue of the grouper, rockcod, hind, coral grouper and lyretail species known to date. Rome: FAO. FAO Fish. Synop., 125(16), 382 p.","FishBase (2010) Life history data on Plectropomus oligacanthus, highfin coralgrouper. Accessed 1/4/16.","FishBase (2010) Life history data on Plectropomus oligacanthus, highfin coralgrouper. Accessed 1/4/16.","FishBase (2010) Life history data on Plectropomus oligacanthus, highfin coralgrouper. Accessed 1/4/16.","IGFA (2001) Database of IGFA angling records until 2001. IGFA, Fort Lauderdale, USA.","IGFA (2001) Database of IGFA angling records until 2001. IGFA, Fort Lauderdale, USA.","FishBase (2010) Life history data on Plectropomus oligacanthus, highfin coralgrouper. Accessed 1/4/16.",Incofish equation: M95=M50*1.14.
Indonesia,Portunus pelagicus,Blue Swimming Crab,PORTPE,"Pamungkas, Aditya Sinugraha, Zairion, and Kamal, M Mukhlis. Kajian Stok Rajungan (Portunus pelagicus) dengan Analisis Frekuensi Ukuran di Perairan Pesisir Lampung Timur. http://repository.ipb.ac.id/handle/123456789/64573. 2013.","Pamungkas, Aditya Sinugraha, Zairion, and Kamal, M Mukhlis. Kajian Stok Rajungan (Portunus pelagicus) dengan Analisis Frekuensi Ukuran di Perairan Pesisir Lampung Timur. http://repository.ipb.ac.id/handle/123456789/64573. 2013.","Pamungkas, Aditya Sinugraha, Zairion, and Kamal, M Mukhlis. Kajian Stok Rajungan (Portunus pelagicus) dengan Analisis Frekuensi Ukuran di Perairan Pesisir Lampung Timur. http://repository.ipb.ac.id/handle/123456789/64573. 2013.","Dineshbabu AP, B Shridhara, & Y Muniyappa (2008) Biology and exploitation of the blue swimmer crab, Portunus pelagicus, from south Karnataka coast, India. Indian J. Fish., 55(3), 215-220.","Kangas MI (2000) Synopsis of the biology and exploitation of the blue swimmer crab, Portunus pelagicus Linnaeus, in Western Australia. Fisheries Research Division, Western Australia. Fisheries Research Report 121, 1-22.","Kangas MI (2000) Synopsis of the biology and exploitation of the blue swimmer crab, Portunus pelagicus Linnaeus, in Western Australia. Fisheries Research Division, Western Australia. Fisheries Research Report 121, 1-22.","Zairion , Yusli Wardiatno and Achmad Fahrudin. Sexual Maturity, Reproductive Pattern and Spawning Female Population of the Blue Swimming Crab, Portunus pelagicus (Brachyura: Portunidae) in East Lampung Coastal Waters, Indonesia. http://www.indjst.org/index.php/indjst/article/view/69368/54501. 2015.","Zairion , Yusli Wardiatno and Achmad Fahrudin. Sexual Maturity, Reproductive Pattern and Spawning Female Population of the Blue Swimming Crab, Portunus pelagicus (Brachyura: Portunidae) in East Lampung Coastal Waters, Indonesia. http://www.indjst.org/index.php/indjst/article/view/69368/54501. 2015."
Indonesia,Pterocaesio pisang,Banana fusilier,PTERPI,"Cabanban AS (1984) Some aspects of the biology of Pterocaesio pisang (Bleeker 1985) (Pisces: Caesionidae) in central Visayas. MS thesis, University of the Philippines, Diliman, Quezon City. pp. 69.","Cabanban AS (1984) Some aspects of the biology of Pterocaesio pisang (Bleeker 1985) (Pisces: Caesionidae) in central Visayas. MS thesis, University of the Philippines, Diliman, Quezon City. pp. 69.","Cabanban AS (1984) Some aspects of the biology of Pterocaesio pisang (Bleeker 1985) (Pisces: Caesionidae) in central Visayas. MS thesis, University of the Philippines, Diliman, Quezon City. pp. 69.","Russ GR, AC Alcala, & AS Cabanban (1992) Marine reserves and fisheries management on coral reefs with preliminary modelling of the effects on yield per recruit. Proceedings of the Seventh International Coral Reef Symposium, Guam, Volume 2, 978-985.","Cabanban AS (1984) Some aspects of the biology of Pterocaesio pisang (Bleeker 1985) (Pisces: Caesionidae) in central Visayas. MS thesis, University of the Philippines, Diliman, Quezon City. pp. 69.","Cabanban AS (1984) Some aspects of the biology of Pterocaesio pisang (Bleeker 1985) (Pisces: Caesionidae) in central Visayas. MS thesis, University of the Philippines, Diliman, Quezon City. pp. 69.","FishBase (2014) Life history data on Pterocaesio pisang, banana fusilier. Accessed 1/4/16.",Incofish equation: M95=M50*1.14.
Indonesia,Pterocaesio tile,Dark-banded fusilier,PTERTI,"FishBase (2010) Life history data on Pterocaesio tile, dark-banded fusilier. Accessed 12/21/15.","FishBase (2010) Life history data on Pterocaesio tile, dark-banded fusilier. Accessed 12/21/15.","FishBase (2010) Life history data on Pterocaesio tile, dark-banded fusilier. Accessed 12/21/15.","FishBase (2010) Life history data on Pterocaesio tile, dark-banded fusilier. Accessed 12/21/15.","Pauly D, R Froese, & JS Albert (1998) The BRAINS table. p. 195-198. In R Froese & D Pauly (eds.) FishBase 98: concepts, design and data sources. ICLARM, Manila, Philippines. 298 p.","Pauly D, R Froese, & JS Albert (1998) The BRAINS table. p. 195-198. In R Froese & D Pauly (eds.) FishBase 98: concepts, design and data sources. ICLARM, Manila, Philippines. 298 p.","FishBase (2010) Life history data on Pterocaesio tile, dark-banded fusilier. Accessed 12/21/15.",Incofish equation: M95=M50*1.14.
Indonesia,Rastrelliger kanagurta,Indian mackerel,RASTKA,"Guanco MR (1991) Growth and mortality of indian mackerel, Rastrelliger kanagurta (Scombridae) in the Visayas Sea, Central Philippines. Fishbyte ICLARM, 9, 13-15.","Guanco MR (1991) Growth and mortality of indian mackerel, Rastrelliger kanagurta (Scombridae) in the Visayas Sea, Central Philippines. Fishbyte ICLARM, 9, 13-15.","Guanco MR (1991) Growth and mortality of indian mackerel, Rastrelliger kanagurta (Scombridae) in the Visayas Sea, Central Philippines. Fishbyte ICLARM, 9, 13-15.","Guanco MR (1991) Growth and mortality of indian mackerel, Rastrelliger kanagurta (Scombridae) in the Visayas Sea, Central Philippines. Fishbyte ICLARM, 9, 13-15.","Rahman MM & A Hafzath (2012) Condition, length-weight relationship, sex ratio and gonadosomatic index of Indian mackerel (Rastrelliger kanagurta) captured from Kuantan coastal water. Journal of Biological Sciences, 12: 426-432.","Rahman MM & A Hafzath (2012) Condition, length-weight relationship, sex ratio and gonadosomatic index of Indian mackerel (Rastrelliger kanagurta) captured from Kuantan coastal water. Journal of Biological Sciences, 12: 426-432.","Rohit P & AC Gupta (2004) Fishery, biology and stock of the Indian mackerel Rastrelliger kanagurta off Mangalore-Malpe in Karnataka, India. Journal of the Marine Biological Association of India, 46(2), 185-191.",Incofish equation: M95=M50*1.14.
Indonesia,Scarus ghobban,Blue-eyed parrotfish,SCARGH,"Sabetian, A., 2010. Parrotfish fisheries and population dynamics: a case-study from Solomon Islands.","Sabetian, A., 2010. Parrotfish fisheries and population dynamics: a case-study from Solomon Islands.","Sabetian, A., 2010. Parrotfish fisheries and population dynamics: a case-study from Solomon Islands.","Parenti, Paolo and Randall, J.E., 2000. An annotated checklist of the species of the Labroid fish families Labridae and Scaridae [WWW Document]. chthyological Bull. J.L.B. Smith Inst. Ichthyol. No. 68. URL http://www.bioline.org.br/request?fb00001 (accessed 2.4.16).","Murty, V.S., 2002. Marine ornamental fish resources of Lakshadweep. C. Spec. Publ.","Murty, V.S., 2002. Marine ornamental fish resources of Lakshadweep. C. Spec. Publ.","Sabetian, A., 2010. Parrotfish fisheries and population dynamics: a case-study from Solomon Islands.",Incofish equation: M95=M50*1.14.
Indonesia,Variola albimarginata,White-edged lyretail,VARIAL,"Mapleston A, LM Currey, AJ Williams et al. (2009) Comparative biology of key inter-reefal serranid species on the Great Barrier Reef. Project Milestone Report to the Marine and Tropical Sciences Research Facility. Reef and Rainforest Research Centre Limited, Cairns. pp. 55.","Mapleston A, LM Currey, AJ Williams et al. (2009) Comparative biology of key inter-reefal serranid species on the Great Barrier Reef. Project Milestone Report to the Marine and Tropical Sciences Research Facility. Reef and Rainforest Research Centre Limited, Cairns. pp. 55.","Mapleston A, LM Currey, AJ Williams et al. (2009) Comparative biology of key inter-reefal serranid species on the Great Barrier Reef. Project Milestone Report to the Marine and Tropical Sciences Research Facility. Reef and Rainforest Research Centre Limited, Cairns. pp. 55.","Mapleston A, LM Currey, AJ Williams et al. (2009) Comparative biology of key inter-reefal serranid species on the Great Barrier Reef. Project Milestone Report to the Marine and Tropical Sciences Research Facility. Reef and Rainforest Research Centre Limited, Cairns. pp. 55.","Fry GC, DT Brewer, & WN Venables (2006) Vulnerability of deepwater demersal fishes to commercial fishing: evidence from a study around a tropical volcanic seamount in Papua New Guinea. Fisheries Research, 81(2-3), 126-141.","Fry GC, DT Brewer, & WN Venables (2006) Vulnerability of deepwater demersal fishes to commercial fishing: evidence from a study around a tropical volcanic seamount in Papua New Guinea. Fisheries Research, 81(2-3), 126-141.","Mapleston A, LM Currey, AJ Williams et al. (2009) Comparative biology of key inter-reefal serranid species on the Great Barrier Reef. Project Milestone Report to the Marine and Tropical Sciences Research Facility. Reef and Rainforest Research Centre Limited, Cairns. pp. 55.","Mapleston A, LM Currey, AJ Williams et al. (2009) Comparative biology of key inter-reefal serranid species on the Great Barrier Reef. Project Milestone Report to the Marine and Tropical Sciences Research Facility. Reef and Rainforest Research Centre Limited, Cairns. pp. 55."
Indonesia,Variola louti,Yellow-edged lyretail,VARILO,"Mapleston A, LM Currey, AJ Williams et al. (2009) Comparative biology of key inter-reefal serranid species on the Great Barrier Reef. Project Milestone Report to the Marine and Tropical Sciences Research Facility. Reef and Rainforest Research Centre Limited, Cairns. pp. 55.","Mapleston A, LM Currey, AJ Williams et al. (2009) Comparative biology of key inter-reefal serranid species on the Great Barrier Reef. Project Milestone Report to the Marine and Tropical Sciences Research Facility. Reef and Rainforest Research Centre Limited, Cairns. pp. 55.","Mapleston A, LM Currey, AJ Williams et al. (2009) Comparative biology of key inter-reefal serranid species on the Great Barrier Reef. Project Milestone Report to the Marine and Tropical Sciences Research Facility. Reef and Rainforest Research Centre Limited, Cairns. pp. 55.","Mapleston A, LM Currey, AJ Williams et al. (2009) Comparative biology of key inter-reefal serranid species on the Great Barrier Reef. Project Milestone Report to the Marine and Tropical Sciences Research Facility. Reef and Rainforest Research Centre Limited, Cairns. pp. 55.","Kulbicki M, N Guillemot, & M Amand (2005) A general approach to length-weight relationships for New Caledonian lagoon fishes. Cybium, 29(3), 235-252.","Kulbicki M, N Guillemot, & M Amand (2005) A general approach to length-weight relationships for New Caledonian lagoon fishes. Cybium, 29(3), 235-252.","Mapleston A, LM Currey, AJ Williams et al. (2009) Comparative biology of key inter-reefal serranid species on the Great Barrier Reef. Project Milestone Report to the Marine and Tropical Sciences Research Facility. Reef and Rainforest Research Centre Limited, Cairns. pp. 55.","Mapleston A, LM Currey, AJ Williams et al. (2009) Comparative biology of key inter-reefal serranid species on the Great Barrier Reef. Project Milestone Report to the Marine and Tropical Sciences Research Facility. Reef and Rainforest Research Centre Limited, Cairns. pp. 55."
Indonesia,Actinopyga echinites,Sea cucumber (Deep water redfish),ACTIEC,NA,NA,NA,"Conand C (1991) Long-term movements and mortality of some tropical sea- cucumbers monitored by tagging and recapture. In: T Yanagisawa et al. (eds.) Biology of Echinodermata, p. 169-175. Rotterdam: A.A. Balkema.",NA,NA,NA,NA
Indonesia,Actinopyga lecanora,Sea cucumber (Stonefish),ACTILE,NA,NA,NA,"Plaganyi EE, T Skewes, N Murphy, R Pascual, & M Fischer (2015) Crop rotations in the sea: increasing returns and reducing risk of collapse in sea cucumber fisheries. PNAS, 112(21), 6760-6765.",NA,NA,NA,NA
Indonesia,Actinopyga miliaris,Sea cucumber (Blackfish),ACTIMI,NA,NA,NA,"Plaganyi EE, T Skewes, N Murphy, R Pascual, & M Fischer (2015) Crop rotations in the sea: increasing returns and reducing risk of collapse in sea cucumber fisheries. PNAS, 112(21), 6760-6765.",NA,NA,NA,NA
Indonesia,Bohadschia argus,Sea cucumber (Leopard fish),BOHAAR,NA,NA,NA,"Plaganyi EE, T Skewes, N Murphy, R Pascual, & M Fischer (2015) Crop rotations in the sea: increasing returns and reducing risk of collapse in sea cucumber fisheries. PNAS, 112(21), 6760-6765.",NA,NA,NA,NA
Indonesia,Holothuria fuscogilva,Sea cucumber (White teatfish),HOLOGI,NA,NA,NA,"Plaganyi EE, T Skewes, N Murphy, R Pascual, & M Fischer (2015) Crop rotations in the sea: increasing returns and reducing risk of collapse in sea cucumber fisheries. PNAS, 112(21), 6760-6765.",NA,NA,"Reichenbach N (1999) Ecology and fishery biology of Holothuria fuscogilva (Echinodermata: Holothuroidea) in the Maldives, Indian Ocean. Bulletin of Marine Science, 64(1), 103-113. 
Plaganyi EE, T Skewes, N Murphy, R Pascual, & M Fischer (2015) Crop rotations in the sea: increasing returns and reducing risk of collapse in sea cucumber fisheries. PNAS, 112(21), 6760-6765.",NA
Indonesia,Holothuria fuscopunctata,Sea cucumber (Elephant trunkfish),HOLOPU,NA,NA,NA,"Plaganyi EE, T Skewes, N Murphy, R Pascual, & M Fischer (2015) Crop rotations in the sea: increasing returns and reducing risk of collapse in sea cucumber fisheries. PNAS, 112(21), 6760-6765.",NA,NA,NA,NA
Indonesia,Holothuria nobilis,Sea cucumber (Black teatfish),HOLONO,NA,NA,NA,"Plaganyi EE, T Skewes, N Murphy, R Pascual, & M Fischer (2015) Crop rotations in the sea: increasing returns and reducing risk of collapse in sea cucumber fisheries. PNAS, 112(21), 6760-6765.",NA,NA,NA,NA
Indonesia,Holothuria scabra,Sea cucumber (Sandfish),HOLOSC,NA,NA,NA,"Plaganyi EE, T Skewes, N Murphy, R Pascual, & M Fischer (2015) Crop rotations in the sea: increasing returns and reducing risk of collapse in sea cucumber fisheries. PNAS, 112(21), 6760-6765.",NA,NA,"Plaganyi EE, T Skewes, N Murphy, R Pascual, & M Fischer (2015) Crop rotations in the sea: increasing returns and reducing risk of collapse in sea cucumber fisheries. PNAS, 112(21), 6760-6765.",NA
Indonesia,Thelenota ananas,Sea cucumber (Prickly redfish),THELAN,NA,NA,NA,"Plaganyi EE, T Skewes, N Murphy, R Pascual, & M Fischer (2015) Crop rotations in the sea: increasing returns and reducing risk of collapse in sea cucumber fisheries. PNAS, 112(21), 6760-6765.",NA,NA,"Plaganyi EE, T Skewes, N Murphy, R Pascual, & M Fischer (2015) Crop rotations in the sea: increasing returns and reducing risk of collapse in sea cucumber fisheries. PNAS, 112(21), 6760-6765.",NA
Brazil,Cynoscion acoupa,Acoupa weakfish,CYNOAC,"Cutrim Souza RF, L Alves de Souza, B Bentes da Silva et al. (2003) Dinamica populacional da pescada amarela Cynoscion acoupa da costa norte do Brasil.","Cutrim Souza RF, L Alves de Souza, B Bentes da Silva et al. (2003) Dinamica populacional da pescada amarela Cynoscion acoupa da costa norte do Brasil.","Cutrim Souza RF, L Alves de Souza, B Bentes da Silva et al. (2003) Dinamica populacional da pescada amarela Cynoscion acoupa da costa norte do Brasil.","Cutrim Souza RF, L Alves de Souza, B Bentes da Silva et al. (2003) Dinamica populacional da pescada amarela Cynoscion acoupa da costa norte do Brasil.","Joyeux JC, T Giarrizzo, RM Macieira, HL Spach, and T Vaske Jr (2009) Length–weight relationships for Brazilian estuarine fishes along a latitudinal gradient. Journal of Applied Ichthyology, 25: 350–355.","Joyeux JC, T Giarrizzo, RM Macieira, HL Spach, and T Vaske Jr (2009) Length–weight relationships for Brazilian estuarine fishes along a latitudinal gradient. Journal of Applied Ichthyology, 25: 350–355.","da Silva de Almeida Z (2008) Os recursos pesqueiros marinhos e estuarinos do Maranhao: biologia, tecnologia, socioeconomia, estado da arte e manejo. Thesis, Universidade Federal do Para, Brazil.",Incofish equation.
